uuid,fishbase_spec_code,commonName,featureImageURL,scientificName,category,subCategory,familyName,aboutText,minSizeMeters,maxSizeMeters,minDepthMeters,maxDepthMeters,distinctiveFeatures,Abundance,habitatBehavior,diverReaction,needs_subcategory,imageLicense,imageAttribution,imageSource,imageNeedsReview
marine-life-ladyfish,175,Ladyfish,https://upload.wikimedia.org/wikipedia/commons/thumb/b/ba/1._Elops_Saurus%2C_The_Saure%3B_3._Atherina_Hepsetus%2C_The_Atherine_%28NYPL_b13637086-404246%29.tiff/lossy-page1-960px-1._Elops_Saurus%2C_The_Saure%3B_3._Atherina_Hepsetus%2C_The_Atherine_%28NYPL_b13637086-404246%29.tiff.jpg,Elops saurus,fish,,Elopidae,"Occur in shallow neritic areas, over muddy bottoms (Ref. 5217). Also found in brackish estuaries and juveniles are common in lagoons and hyper-saline bays (Ref. 5217). Form large schools close to the shore (Ref. 9987). Feed mainly on crustaceans and small fishes. Spawn in the open sea (Ref. 5217). Larval development is represented by profound changes in body form accompanied by 2 periods of length increase, interspaced by a period of length decrease (Ref. 4639). Noted for their habit of skipping along the surface of the water and for jumping after being hooked (Ref. 5521). Marketed fresh, salted and frozen but considered a second rate food fish (Ref. 3718). <i>Rhynchobothrium bulbifer</i> found in the viscera of the adult (Ref. 37032).",,1,0,50,Body shape: elongated,,,,yes,Public domain,"""1. Elops Saurus, The Saure; 3. Atherina Hepsetus, The Atherine (NYPL b13637086-404246).tiff"" by chez l'auteur; [etc., etc.,] (Public domain).",wikimedia,
marine-life-lancer-dragonet,3824,Lancer dragonet,https://upload.wikimedia.org/wikipedia/commons/thumb/a/a2/Environmental_appendix-_Miami-Dade_County_Back_Bay_coastal_storm_risk_management_feasibility_study%2C_Miami-Dade_County%2C_Florida-_Appendix_D_-_USACE-p16021coll7-14462.pdf/page1-960px-thumbnail.pdf.jpg,Callionymus bairdi,fish,bottom-dwellers,Callionymidae,"Inhabits shallow reefs, including <i>Thalassia testudinum</i> beds (Ref. 13628).",,0.114,1,91,Body shape: elongated,,,,,Public domain,"""Environmental appendix- Miami-Dade County Back Bay coastal storm risk management feasibility study, Miami-Dade County, Florida- Appendix D - USACE-p16021coll7-14462.pdf"" by United States. Army. Corps of Engineers. Norfolk District (Public domain).",wikimedia,yes
marine-life-lancer-red-banner-blenny,70135,Lancer red banner blenny,,Emblemariopsis lancea,fish,gobies-and-blennies,Chaenopsidae,"The reported depth range is from 1–15 m. Photographs show dark males in holes in both live and dead corals, of many species and of different morphologies, including holes embedded among encrusting sponges. IP fish perch on all substrates, living and dead, and are often found on sponges (Ref. 125603).",,0.0243,1,15,Body shape: elongated,,,,,,,,
marine-life-lantern-bass,3344,Lantern bass,https://upload.wikimedia.org/wikipedia/commons/thumb/4/46/Serranus_baldwini_-_pone.0010676.g060.png/960px-Serranus_baldwini_-_pone.0010676.g060.png,Serranus baldwini,fish,groupers-and-bass,Serranidae,Inhabits rocky and weedy areas. Synchronously hermaphroditic. Feeds on caridean shrimp and small fish (Ref. 5521).,,0.12,1,80,Body shape: fusiform / normal,,,,,CC BY 2.5,"""Serranus baldwini - pone.0010676.g060.png"" by Williams, J. T.; Carpenter, K. E.; Van Tassell, J. L.; Hoetjes, P.; Toller, W.; Etnoyer, P.; Smith, M. (CC BY 2.5). https://creativecommons.org/licenses/by/2.5",wikimedia,
marine-life-leatherjacket,1001,Leatherjacket,https://upload.wikimedia.org/wikipedia/commons/thumb/f/f6/Oligoplites_saurus.11B.jpg/960px-Oligoplites_saurus.11B.jpg,Oligoplites saurus,fish,silvery,Carangidae,"Adults are found inshore, usually along sandy beaches, in bays and inlets. They enter estuaries and fresh water, preferring turbid water. They occur in schools, usually large and fast moving, often leaping out of the water. Juveniles may float at the surface with tail bent and head down. Adults feed on fishes and crustaceans. The dorsal and anal spines are connected to venomous glands that can inflict painful wounds (Ref. 9283). Venom glands were not visible however, and cannot be confirmed in the specimen according to Smith and Wheeler, 2006 (Ref. 57406). Current information for this species as being dangerous need verification. Juveniles have incisor-like outer teeth and serve as cleaners for other fish; as fish grow, their teeth become conical and their diet changes (Ref. 26938). Marketed fresh and salted or dried but the flesh is not highly esteemed (Ref. 9283).",,0.35,0,50,Body shape: fusiform / normal,,,,,Public domain,"""Oligoplites saurus.11B.jpg"" by <a href=""https://en.wikipedia.org/wiki/User:Boris_m_luts"" class=""extiw"" title=""wikipedia:User:Boris m luts"">Boris m luts</a> at <a href=""https://en.wikipedia.org/wiki/"" class=""extiw"" title=""wikipedia:"">English Wikipedia</a> (Public domain).",wikimedia,
marine-life-lemon-shark,897,Lemon shark,https://upload.wikimedia.org/wikipedia/commons/thumb/1/1f/Negaprion_brevirostris_distribution_map.png/960px-Negaprion_brevirostris_distribution_map.png,Negaprion brevirostris,fish,sharks-and-rays,Carcharhinidae,"Occurs on continental and insular shelves, frequenting mangrove fringes, coral keys, docks, sand or coral mud bottoms, saline creeks, enclosed bays or sounds, and river mouths. May enter fresh water. Occasionally moves into the open ocean, near or at the surface, apparently for purposes of migration. May rest motionless on the bottom (Ref. 9710). May occur singly or in small groups. Feeds mainly on fish but also takes crustaceans and mollusks. Viviparous, with 4 to 17 young in a litter. Size at birth 60 to 65 cm. Has been involved in several attacks on people. Meat is utilized for human consumption, hides for leather, fins for shark-fin soup base, liver oil for vitamins, and carcasses for fish meal. Marketed fresh, dried-salted and frozen (Ref. 9987).",,3.4,0,92,Body shape: fusiform / normal,,,,,Public domain,"""Negaprion brevirostris distribution map.png"" by No machine-readable author provided. <a href=""//commons.wikimedia.org/wiki/User:Jonathan_Hornung"" title=""User:Jonathan Hornung"">Jonathan Hornung</a> assumed (based on copyright claims). (Public domain).",wikimedia,
marine-life-lesser-devil-ray,2586,Lesser devil ray,https://upload.wikimedia.org/wikipedia/commons/thumb/9/9e/FMIB_40286_Mobula_hypostoma%2C_a_catch_of_nine%2C_taken_by_Mr_Russell_J_Coles_%28second_from_the_right%29_at_Cape_Lookout%2C_N_C%2C_July_10%2C_1913.jpeg/960px-FMIB_40286_Mobula_hypostoma%2C_a_catch_of_nine%2C_taken_by_Mr_Russell_J_Coles_%28second_from_the_right%29_at_Cape_Lookout%2C_N_C%2C_July_10%2C_1913.jpeg,Mobula hypostoma,fish,,Mobulidae,"Occurs in shallow coastal waters (Ref. 12951). Feeds mainly on planktonic crustaceans but may take small schooling fishes (Ref. 12951). Ovoviviparous (Ref. 50449). Found singly, in small groups, and in schools (Ref. 12951). Swimming at high speed and often leap high above the surface (Ref. 6902). Feeds mainly on planktonic crustaceans, but also on small schooling fishes (Ref. 114953). Meat used for food and a source of oil (Ref. 6902).",,2.3,0,100,Body shape: other,,,,yes,Public domain,"""FMIB 40286 Mobula hypostoma, a catch of nine, taken by Mr Russell J Coles (second from the right) at Cape Lookout, N C, July 10, 1913.jpeg"" by <bdi><a href=""https://en.wikipedia.org/wiki/en:Francis_Harper_(biologist)"" class=""extiw"" title=""w:en:Francis Harper (biologist)""><span title=""U.S naturalist (1886–1972)"">Francis Harper</span></a></bdi> (Public domain).",wikimedia,
marine-life-lesser-electric-ray,53905,Lesser electric ray,https://upload.wikimedia.org/wikipedia/commons/thumb/4/42/Torpedo_bancroftii_in_Cuvier%2C1834%28valid_name_Narcine_bancroftii%29.jpg/960px-Torpedo_bancroftii_in_Cuvier%2C1834%28valid_name_Narcine_bancroftii%29.jpg,Narcine bancroftii,fish,,Narcinidae,A benthic species on continental and insular shelves. Mainly feeds on invertebrates suction-fed off the bottom. Produces up to 16 embryos during each gestation. Maturity size of males at ca. 23 cm TL; birth size observed to be ca. 9 cm TL (Ref. 114953).,,0.65,,35,Body shape: other,,,,yes,Public domain,"""Torpedo bancroftii in Cuvier,1834(valid name Narcine bancroftii).jpg"" by Civer, G.L.C.F.D. &amp; Griffith, E. &amp; Smith, C. (Public domain).",wikimedia,
marine-life-letter-opener,16527,Letter opener,https://upload.wikimedia.org/wikipedia/commons/thumb/7/73/Reports_of_explorations_and_surveys%2C_to_ascertain_the_most_practicable_and_economical_route_for_a_railroad_from_the_Mississippi_River_to_the_Pacific_Ocean_%28IA_reportsofexplora10unit%29.pdf/page1-960px-thumbnail.pdf.jpg,Ophidion nocomis,fish,,Ophidiidae,"Uncommon species found on shallow sandy bays (Ref. 34024). Oviparous, with oval pelagic eggs floating in a gelatinous mass (Ref. 205).",,0.087,1,22,Body shape: Elongated,,,,yes,Public domain,"""Reports of explorations and surveys, to ascertain the most practicable and economical route for a railroad from the Mississippi River to the Pacific Ocean (IA reportsofexplora10unit).pdf"" by <div class=""fn value"">
<dl><dd>United States. War Dept</dd>
<dd>United States. Army. Corps of Engineers</dd>
<dd>Henry, Joseph, 1797-1878</dd>
<dd>Baird, Spencer Fullerton, 1823-1887</dd></dl></div> (Public domain).",wikimedia,yes
marine-life-lined-seahorse,3283,Lined seahorse,https://upload.wikimedia.org/wikipedia/commons/5/52/Hippocampus_erectus_301805144.jpg,Hippocampus erectus,fish,odd-shaped,Syngnathidae,"Generally in coastal waters; often around man-made structures (Ref. 26938). Usually attached to gorgonians or seagrasses but may occur in floating <i>Sargassum</i> or swimming freely in midwater (Ref. 9710). Those that live in <i>Sargassum</i> usually have bony protuberances and fleshy tabs that may serve as camouflage. Has been reared in captivity (Ref. 35420, 35422). Move into deeper waters during winter (Ref. 36630). Feeds by sucking in small organisms, using its long face as a pipette (Ref. 26938); like small crustaceans (Ref. 27549). Ovoviviparous (Ref. 205). The male carries the eggs in a brood pouch which is found under the tail (Ref. 205). Length type refers to Height (= from top of coronet to the tip of straightened tail).",,0.19,0,100,Body shape: other,,,,,CC BY 4.0,"""Hippocampus erectus 301805144.jpg"" by <a rel=""nofollow"" class=""external text"" href=""https://www.inaturalist.org/users/5020937"">Pauline Walsh Jacobson</a> (CC BY 4.0). https://creativecommons.org/licenses/by/4.0",wikimedia,
marine-life-lined-sole,4256,Lined sole,https://upload.wikimedia.org/wikipedia/commons/thumb/f/f2/Achirus_lineatus_engraving.jpg/960px-Achirus_lineatus_engraving.jpg,Achirus lineatus,fish,,Achiridae,"Adults occur mainly in brackish or hyper-saline lagoons (Ref. 5217), on sandy-muddy bottoms of estuaries and in the littoral zone where it hides itself leaving just its eyes out. Can easily disguise itself in the environment. Feed on worms, crustaceans and small fishes. Juveniles have a brief planktonic life, moving quickly to the benthic stage. Growth rate is relatively slow (Ref. 35237).",,0.331,1,20,Body shape: short and / or deep,,,,yes,Public domain,"""Achirus lineatus engraving.jpg"" by <bdi><a href=""https://www.wikidata.org/wiki/Q20890047"" class=""extiw"" title=""d:Q20890047""><span title=""American artist"">H. L. Todd</span></a></bdi> (Public domain).",wikimedia,
marine-life-liopropoma-danae,61261,Liopropoma danae,https://upload.wikimedia.org/wikipedia/commons/thumb/a/a2/Environmental_appendix-_Miami-Dade_County_Back_Bay_coastal_storm_risk_management_feasibility_study%2C_Miami-Dade_County%2C_Florida-_Appendix_D_-_USACE-p16021coll7-14462.pdf/page1-960px-thumbnail.pdf.jpg,Liopropoma danae,fish,,Liopropomatidae,Minimum depth from Ref. 58018.,,,,35,Body shape: Elongated,,,,yes,Public domain,"""Environmental appendix- Miami-Dade County Back Bay coastal storm risk management feasibility study, Miami-Dade County, Florida- Appendix D - USACE-p16021coll7-14462.pdf"" by United States. Army. Corps of Engineers. Norfolk District (Public domain).",wikimedia,yes
marine-life-little-croaker,14681,Little croaker,https://upload.wikimedia.org/wikipedia/commons/thumb/0/0b/Pteraster_stellifer_%28USNM_1116277%29_003.jpeg/960px-Pteraster_stellifer_%28USNM_1116277%29_003.jpeg,Stellifer stellifer,fish,grunts-and-snappers,Sciaenidae,"Found over shallow, muddy or sandy mud bottoms of estuaries and its adjacent areas.",,0.21,1,35,Body shape: fusiform / normal,,,,,CC0,"""Pteraster stellifer (USNM 1116277) 003.jpeg"" by <div class=""fn value"">
Adrian James Testa</div> (CC0). http://creativecommons.org/publicdomain/zero/1.0/deed.en",wikimedia,
marine-life-little-eye-round-herring,1462,Little-eye round herring,https://upload.wikimedia.org/wikipedia/commons/thumb/a/a2/Environmental_appendix-_Miami-Dade_County_Back_Bay_coastal_storm_risk_management_feasibility_study%2C_Miami-Dade_County%2C_Florida-_Appendix_D_-_USACE-p16021coll7-14462.pdf/page1-960px-thumbnail.pdf.jpg,Jenkinsia majua,fish,,Spratelloididae,"Usually an inshore schooling species, feeding on zooplankton.",,0.055,0,50,Body shape: elongated,,,,yes,Public domain,"""Environmental appendix- Miami-Dade County Back Bay coastal storm risk management feasibility study, Miami-Dade County, Florida- Appendix D - USACE-p16021coll7-14462.pdf"" by United States. Army. Corps of Engineers. Norfolk District (Public domain).",wikimedia,yes
marine-life-littlehead-porgy,1229,Littlehead porgy,https://upload.wikimedia.org/wikipedia/commons/f/fb/FMIB_33916_Calamus_Proridens_Jordan_and_Gilbert.jpeg,Calamus proridens,fish,silvery,Sparidae,Found primarily on sponge and coral bottoms. Feeds mainly on invertebrates (Ref. 9739).,,0.46,,59,Body shape: short and / or deep,,,,,Public domain,"""FMIB 33916 Calamus Proridens Jordan and Gilbert.jpeg"" by <bdi><a href=""https://en.wikipedia.org/wiki/en:David_Starr_Jordan"" class=""extiw"" title=""w:en:David Starr Jordan""><span title=""American ichthyologist and educator (1851-1931)"">David Starr Jordan</span></a></bdi> (Public domain).",wikimedia,
marine-life-live-sharksucker,2467,Live sharksucker,https://upload.wikimedia.org/wikipedia/commons/thumb/6/64/Echeneis_naucrates_126569092.jpg/960px-Echeneis_naucrates_126569092.jpg,Echeneis naucrates,fish,,Echeneidae,"Most abundant remora in warm waters (Ref. 4389). Occurs near as well as far from the coast (Ref. 5217). Often found free-swimming in shallow inshore areas and around coral reefs (Ref. 26938). Attaches temporarily to a variety of hosts including sharks, rays, large bony fishes or sea turtles, whales, dolphins and also to ships. May follow divers (Ref. 9710); reported to attach itself to a diver's leg (Ref. 57809). Feeds on small fishes, bits of its host's prey and host's parasites (Ref. 26938). Juveniles occasionally act as reef station-based cleaners, where they service parrotfishes (Ref. 40095). Sometimes used by natives to aid in fishing; a line is tied to the caudal peduncle of the remora and then is released; upon attaching to another fish, the remora and its host are hauled in by the fisher (Ref. 9682).",,1.1,1,85,Body shape: elongated,,,,yes,CC BY 4.0,"""Echeneis naucrates 126569092.jpg"" by <a rel=""nofollow"" class=""external text"" href=""https://www.inaturalist.org/users/1423996"">Farren Dell</a> (CC BY 4.0). https://creativecommons.org/licenses/by/4.0",wikimedia,
marine-life-lonchopisthus-higmani,27893,Lonchopisthus higmani,,Lonchopisthus higmani,fish,gobies-and-blennies,Opistognathidae,"Found on muddy bottoms. Feed on small decapods, shrimps and fishes. Mouthbrooders (Ref. 240).",,0.135,,100,Body shape: elongated,,,,,,,,
marine-life-longarm-brotula,16421,Longarm brotula,,Calamopteryx goslinei,fish,,Bythitidae,Uncommon species (Ref. 34024). Inhabits coral reefs and is a live-bearing species (Ref. 5521). Minimum depth reported taken from Ref. 5521.,,0.0635,9,55,Body shape: elongated,,,,yes,,,,
marine-life-longeye-conger,2626,Longeye conger,,Gnathophis bracheatopos,fish,eels,Congridae,,,0.35,55,110,Body shape: eel-like,,,,,,,,
marine-life-longfin-damselfish,3649,Longfin damselfish,https://upload.wikimedia.org/wikipedia/commons/thumb/5/5b/Stegastes_diencaeus_468801081.jpg/960px-Stegastes_diencaeus_468801081.jpg,Stegastes diencaeus,fish,small-oval,Pomacentridae,"Adults inhabit coral and rocky reefs of sheltered lagoons and inshore areas. Territorial and pugnacious (Ref. 9710). Oviparous, distinct pairing during breeding (Ref. 205). Eggs are demersal and adhere to the substrate (Ref. 205). Males guard and aerate the eggs (Ref. 205). Taken incidentally in traps and small-meshed beach nets (Ref. 5217).",,0.125,2,45,Body shape: short and / or deep,,,,,CC0,"""Stegastes diencaeus 468801081.jpg"" by <a rel=""nofollow"" class=""external text"" href=""https://www.inaturalist.org/users/3550339"">Jean-Paul Boerekamps</a> (CC0). http://creativecommons.org/publicdomain/zero/1.0/deed.en",wikimedia,
marine-life-longfin-worm-eel,53895,Longfin worm eel,,Myrophis anterodorsalis,fish,eels,Ophichthidae,,,,0,1,Body shape: eel-like,,,,,,,,
marine-life-longfinger-anchovy,926,Longfinger anchovy,,Anchoa filifera,fish,silvery,Engraulidae,"A schooling species occurring in coastal waters. Trawled down to 25 m off Brazil, but equally taken in shore seines and recorded in salinities of 7.94-8.21 ppt in the Canal de Santa Cruz, Pernambuco, Brazil (Ref. 189).",,0.145,,35,Body shape: elongated,,,,,,,,
marine-life-longfinned-coralbrotula,63366,Longfinned coralbrotula,,Ogilbichthys longimanus,fish,,Dinematichthyidae,,,,0,15,Body shape: elongated,,,,yes,,,,
marine-life-longjaw-squirrelfish,3249,Longjaw squirrelfish,https://upload.wikimedia.org/wikipedia/commons/thumb/4/4c/Neoniphon_marianus_Belize.jpg/960px-Neoniphon_marianus_Belize.jpg,Neoniphon marianus,fish,cardinalfish-and-reds,Holocentridae,"Rarely found in shallow water, but appears to be the most common squirrelfish in the depth range of 30-60 m or more (Ref. 32). Reported used as food fish (Ref. 37108).",,0.18,1,70,Body shape: fusiform / normal,,,,,CC0,"""Neoniphon marianus Belize.jpg"" by zygy (CC0). http://creativecommons.org/publicdomain/zero/1.0/deed.en",wikimedia,
marine-life-longlure-frogfish,3084,Longlure frogfish,https://upload.wikimedia.org/wikipedia/commons/thumb/3/39/Antennarius_multiocellatus_179009678.jpg/960px-Antennarius_multiocellatus_179009678.jpg,Antennarius multiocellatus,fish,odd-shaped,Antennariidae,"Inhabit shallow reefs (Ref. 9710). Commonly found in areas with sponges; background hue of the fish conforms to that of the dominant sponge in the areas and the ocelli look like openings in the sponge. Feed mainly on fishes, but also eat crustaceans (Ref. 13442). A voracious predator, with many color phases used for camouflage. Oviparous (Ref. 205). Eggs are bound in ribbon-like sheath or mass of gelatinous mucus called 'egg raft' or 'veil' (Ref. 6773). Most common frogfish in the West Indies (Ref. 26938).",,0.2,0,66,Body shape: short and / or deep,,,,,CC BY 4.0,"""Antennarius multiocellatus 179009678.jpg"" by <a rel=""nofollow"" class=""external text"" href=""https://www.inaturalist.org/users/1850732"">Dan Schofield</a> (CC BY 4.0). https://creativecommons.org/licenses/by/4.0",wikimedia,
marine-life-longnose-stingray,1248,Longnose stingray,https://upload.wikimedia.org/wikipedia/commons/thumb/c/cb/Hypanus_guttatus_263849440.jpeg/960px-Hypanus_guttatus_263849440.jpeg,Hypanus guttatus,fish,sharks-and-rays,Dasyatidae,"Demersal species on continental shelf to at least 35 m (but likely to be deeper); also found in brackish water, with young collected from tide pools (Ref. 114953). Mobile invertebrate feeders, feeds on benthic mobile invertebrates such as molluscs, crustaceans and worms associated with hard or nearby unconsolidated substrate (Ref. 103985); also on small fishes (Ref. 114953). Ovoviviparous (Ref. 50449). Marketed salted; also used in the preparation of gelatin and good quality oil. Between 1995 and 2000, at least 5 specimens have been traded as aquarium fish at Ceará, Brazil (Ref. 49392).",,2,1,36,Body shape: other,,,,,CC0,"""Hypanus guttatus 263849440.jpeg"" by <a rel=""nofollow"" class=""external text"" href=""https://www.inaturalist.org/users/1698881"">Tiago Lubiana</a> (CC0). http://creativecommons.org/publicdomain/zero/1.0/deed.en",wikimedia,
marine-life-longsnout-butterflyfish,3600,Longsnout butterflyfish,https://upload.wikimedia.org/wikipedia/commons/thumb/1/18/Prognathodes_aculeatus_NOAA.jpg/960px-Prognathodes_aculeatus_NOAA.jpg,Prognathodes aculeatus,fish,disk-and-large-oval,Chaetodontidae,"Inhabit deep coral-rich reefs and drop-offs (Ref. 47838). Feed on small invertebrates. Often seen nibbling on the tube feet of sea urchins or the tentacles of tubeworms (Ref. 9710). Unlike some chaetodonts it does not pick parasites from the bodies of other fishes (Ref. 5521). Solitary, sometimes in pairs (Ref. 47838). Seek refuge when approached (Ref. 47838). Oviparous (Ref. 205). Form pairs during breeding (Ref. 205).",,0.1,1,100,Body shape: short and / or deep,,,,,Public domain,"""Prognathodes aculeatus NOAA.jpg"" by NOAA (Public domain).",wikimedia,
marine-life-longsnout-seahorse,3285,Longsnout seahorse,https://upload.wikimedia.org/wikipedia/commons/thumb/8/8d/Longsnout_Seahorse%2C_Hippocampus_reidi.jpg/960px-Longsnout_Seahorse%2C_Hippocampus_reidi.jpg,Hippocampus reidi,fish,odd-shaped,Syngnathidae,"Uncommon in most areas, but may be locally common in certain places. Usually attached to gorgonians or seagrasses but may occur in floating <i>Sargassum</i> or swimming freely in midwater (Ref. 9710). Ovoviviparous (Ref. 205). The male carries the eggs in a brood pouch which is found under the tail (Ref. 205). Has been reared in captivity (Ref. 35409). Length type refers to Height (= from top of coronet to the tip of straightened tail). Maximum depth reported taken from Ref. 128812.",,0.175,0,60,Body shape: other,,,,,CC BY 2.0,"""Longsnout Seahorse, Hippocampus reidi.jpg"" by <a rel=""nofollow"" class=""external text"" href=""https://www.flickr.com/photos/19731486@N07"">Brian Gratwicke</a> (CC BY 2.0). https://creativecommons.org/licenses/by/2.0",wikimedia,
marine-life-longspine-squirrelfish,1062,Longspine squirrelfish,https://upload.wikimedia.org/wikipedia/commons/thumb/0/0c/Holocentrus_rufus_455651215.jpg/960px-Holocentrus_rufus_455651215.jpg,Holocentrus rufus,fish,cardinalfish-and-reds,Holocentridae,"Nocturnal (Ref. 37108), inhabits clear reefs (Ref. 5217). Found near mouths of caves and holes (Ref. 26938); at night they usually move to sandy areas and grass beds to feed on crabs, shrimps, gastropods and brittle stars (Ref. 3724). Marketed fresh but not popular as a food fish (Ref. 5217).",,0.35,0,32,Body shape: fusiform / normal,,,,,CC0,"""Holocentrus rufus 455651215.jpg"" by <a rel=""nofollow"" class=""external text"" href=""https://www.inaturalist.org/users/8375047"">Chris Spain</a> (CC0). http://creativecommons.org/publicdomain/zero/1.0/deed.en",wikimedia,
marine-life-longtrunk-conger,2624,Longtrunk conger,,Ariosoma anale,fish,eels,Congridae,Inhabits rocky or sandy bottoms (Ref. 26340).,,0.363,11,63,Body shape: eel-like,,,,,,,,
marine-life-lookdown,1004,Lookdown,https://upload.wikimedia.org/wikipedia/commons/thumb/9/98/Selene_vomer_SI.jpg/960px-Selene_vomer_SI.jpg,Selene vomer,fish,silvery,Carangidae,"Adults are found in shallow coastal waters, usually over hard or sandy bottoms. Juveniles may be encountered in estuarine areas (Ref. 9626) and off sandy beaches (Ref. 5217). Found in schools, but may be encountered in small groups or in pairs (Ref. 26235). Adults feed on small crabs, shrimps, fishes, and worms. Flesh has excellent flavor (Ref. 5521). Marketed fresh (Ref. 9710).",,0.483,1,53,Body shape: fusiform / normal,,,,,Public domain,"""Selene vomer SI.jpg"" by Sandra Raredon/Smithsonian Institution (Public domain).",wikimedia,
marine-life-lucaya-cavebrotula,63263,Lucaya cavebrotula,,Lucifuga lucayana,fish,,Bythitidae,"Found in an anchialine cave which is connected to the sea via a submerged passage which opens into a tidal saltwater creek. The upper about 14 m in the cave consists of freshwater (22 °C), separated from a lower, slightly warmer (23-25 °C), salty layer by a distinct halocline. The holotype was taken in a depth of 12 m, which must then most likely to be freshwater; some where collected from one or two inland sink holes (Ref. 57878).",,,12,20,Body shape: elongated,,,,yes,,,,
marine-life-lythrypnus-mowbrayi,56505,Lythrypnus mowbrayi,,Lythrypnus mowbrayi,fish,gobies-and-blennies,Gobiidae,Most collections taken from the bases of patch reefs or coral encrusted boulders with undercut ledges (Ref. 34188).,,,4,22,Body shape: fusiform / normal,,,,,,,,
marine-life-madamango-sea-catfish,960,Madamango sea catfish,https://upload.wikimedia.org/wikipedia/commons/thumb/2/2e/Cathorops_spixii_%28Rio_de_Janeiro%2C_Brazil%2C_5_July_1865%29.jpg/960px-Cathorops_spixii_%28Rio_de_Janeiro%2C_Brazil%2C_5_July_1865%29.jpg,Cathorops spixii,fish,,Ariidae,"Found in shallow coastal marine waters and brackish estuaries, lagoons and river mouths. Also in hypersaline waters (Ref. 5217). Feeds mainly on invertebrates and small fishes. Juveniles feed on amphipods, isopods and copepods (Ref. 35381). Flesh considered good quality (Ref. 5217). Sold locally.",,0.3,1,50,Body shape: fusiform / normal,,,,yes,Public domain,"""Cathorops spixii (Rio de Janeiro, Brazil, 5 July 1865).jpg"" by <div class=""fn value"">
<a href=""https://www.wikidata.org/wiki/Q53499085"" class=""extiw"" title=""wikidata:Q53499085"">Burkhardt, Jacques</a></div> (Public domain).",wikimedia,
